{
  "schemaVersion": "1.0.0",
  "status": "descriptive-baseline-not-runtime-authority",
  "sourceRevision": "917550d",
  "nodeIdentity": {
    "fixedRegionIdsAreStable": true,
    "biomeTemplateIdsAreStable": true,
    "streamedRegionInstanceIdFormat": "chunk:{chunkX}:{chunkZ}",
    "chunkKeyFormatInCurrentRuntime": "{chunkX}:{chunkZ}",
    "contiguousVoronoiRegionIdAvailableInCurrentRuntime": false,
    "semanticColorSpace": "sRGB-hex",
    "semanticColorsAreUniqueWithinThisFile": true
  },
  "semanticPriorityHighToLow": [
    "operational-zones",
    "authored-field-zones",
    "fixed-origin-region",
    "procedural-biome-template"
  ],
  "regions": [
    {
      "id": "region-airport-origin",
      "kind": "fixed-authored-overlay",
      "label": "Countryside Airport Origin",
      "semanticColor": "#FF365E",
      "boundary": {
        "kind": "exclusive-aabb-xz",
        "minimum": [-430, -430],
        "maximum": [430, 430],
        "rule": "max(abs(x),abs(z)) < 430"
      },
      "overlaysChunkId": "chunk:0:0",
      "underlyingRegionId": "region-biome-sunlit-meadow",
      "functions": [
        "controlled-aircraft-spawn",
        "manual-takeoff-and-landing",
        "autopilot-showcase",
        "parked-inspection",
        "rural-origin-landmark"
      ],
      "access": {
        "aircraft": "implemented",
        "roadVehicles": "absent",
        "boats": "absent",
        "onFoot": "absent"
      },
      "routeIds": [
        "route-airport-manual-runway-departure",
        "route-autopilot-showcase",
        "route-airport-manual-landing-relaunch",
        "route-reset-to-airport"
      ],
      "spawnIds": ["spawn-aircraft-primary"],
      "materialSetIds": ["material-set-airfield"],
      "preserve": true
    },
    {
      "id": "region-biome-sunlit-meadow",
      "runtimeBiomeId": "sunlit-meadow",
      "kind": "procedural-biome-template",
      "label": "Sunlit Meadow",
      "semanticColor": "#74B84A",
      "terrainProfile": "rolling-meadow",
      "palette": {
        "ground": "#4f843e",
        "roughness": 0.96,
        "primary": "#315f2f",
        "secondary": "#8eb952",
        "accent": "#f1cf52",
        "rock": "#777766",
        "water": "#4f93a6"
      },
      "prototypeTargetsPerChunk": {
        "trees": 46,
        "groundCover": 180,
        "rocks": 32,
        "deadwood": 12
      },
      "repeatedAssetIds": [
        "proto-biome-trunk",
        "proto-biome-canopy",
        "proto-biome-ground-cover",
        "proto-biome-rock",
        "proto-biome-deadwood"
      ],
      "functions": ["natural-countryside", "off-airport-terrain-landing"],
      "waterAccess": "none",
      "roadAccess": "none"
    },
    {
      "id": "region-biome-sahara-dunes",
      "runtimeBiomeId": "sahara-dunes",
      "kind": "procedural-biome-template",
      "label": "Sahara Dunes",
      "semanticColor": "#D89A3D",
      "terrainProfile": "wave-dunes",
      "palette": {
        "ground": "#c98c45",
        "roughness": 1,
        "primary": "#477342",
        "secondary": "#e8b85f",
        "accent": "#d66b2d",
        "rock": "#9f5d32",
        "water": "#4e9aab"
      },
      "prototypeTargetsPerChunk": {
        "mesas": 34,
        "cacti": 34,
        "rocks": 54,
        "groundCover": 70
      },
      "repeatedAssetIds": [
        "proto-biome-mesa",
        "proto-biome-cactus",
        "proto-biome-rock",
        "proto-biome-ground-cover"
      ],
      "functions": ["arid-flight-scenery", "off-airport-terrain-landing"],
      "waterAccess": "none",
      "roadAccess": "none"
    },
    {
      "id": "region-biome-alpine-peaks",
      "runtimeBiomeId": "alpine-peaks",
      "kind": "procedural-biome-template",
      "label": "Alpine Peaks",
      "semanticColor": "#6C7C8C",
      "terrainProfile": "highest-ridged-relief",
      "palette": {
        "ground": "#788276",
        "roughness": 0.92,
        "primary": "#234b3f",
        "secondary": "#dbe1db",
        "accent": "#c7d9e5",
        "rock": "#5e6465",
        "water": "#538aa1"
      },
      "prototypeTargetsPerChunk": {
        "conifers": 74,
        "mesas": 28,
        "rocks": 58,
        "snowPatches": 38
      },
      "repeatedAssetIds": [
        "proto-biome-trunk",
        "proto-biome-conifer",
        "proto-biome-mesa",
        "proto-biome-rock",
        "proto-biome-snow"
      ],
      "functions": ["mountain-flight-scenery", "conditional-off-airport-terrain-landing"],
      "waterAccess": "none",
      "roadAccess": "none"
    },
    {
      "id": "region-biome-arctic-tundra",
      "runtimeBiomeId": "arctic-tundra",
      "kind": "procedural-biome-template",
      "label": "Arctic Tundra",
      "semanticColor": "#D9F1F2",
      "terrainProfile": "low-icy-ridges",
      "palette": {
        "ground": "#c8d6d5",
        "roughness": 0.76,
        "primary": "#78918e",
        "secondary": "#eaf2ef",
        "accent": "#8bd4df",
        "rock": "#78878b",
        "water": "#5e9fb4"
      },
      "prototypeTargetsPerChunk": {
        "snowPatches": 62,
        "crystals": 58,
        "visualWaterOrIcePatches": 24,
        "rocks": 38
      },
      "repeatedAssetIds": [
        "proto-biome-snow",
        "proto-biome-crystal",
        "proto-biome-water",
        "proto-biome-rock"
      ],
      "functions": ["polar-flight-scenery", "conditional-off-airport-terrain-landing"],
      "waterAccess": "visual-only",
      "roadAccess": "none"
    },
    {
      "id": "region-biome-volcanic-wastes",
      "runtimeBiomeId": "volcanic-wastes",
      "kind": "procedural-biome-template",
      "label": "Volcanic Wastes",
      "semanticColor": "#4A3033",
      "terrainProfile": "steep-volcanic-ridges",
      "palette": {
        "ground": "#292b2a",
        "roughness": 0.98,
        "primary": "#3b3b38",
        "secondary": "#646158",
        "accent": "#f05b21",
        "rock": "#151918",
        "water": "#f17a20"
      },
      "prototypeTargetsPerChunk": {
        "rocks": 88,
        "mesas": 38,
        "glowFissures": 38,
        "crystals": 24
      },
      "repeatedAssetIds": [
        "proto-biome-rock",
        "proto-biome-mesa",
        "proto-biome-glow",
        "proto-biome-crystal"
      ],
      "functions": ["volcanic-flight-scenery", "conditional-off-airport-terrain-landing"],
      "waterAccess": "none",
      "roadAccess": "none"
    },
    {
      "id": "region-biome-emerald-marsh",
      "runtimeBiomeId": "emerald-marsh",
      "kind": "procedural-biome-template",
      "label": "Emerald Marsh",
      "semanticColor": "#2C7D68",
      "terrainProfile": "very-low-wet-terrain",
      "palette": {
        "ground": "#536a43",
        "roughness": 0.94,
        "primary": "#314d33",
        "secondary": "#809047",
        "accent": "#b3c26a",
        "rock": "#555d4e",
        "water": "#315f5c"
      },
      "prototypeTargetsPerChunk": {
        "visualWaterPatches": 38,
        "reeds": 190,
        "deadwood": 42,
        "groundCover": 90
      },
      "repeatedAssetIds": [
        "proto-biome-water",
        "proto-biome-reed",
        "proto-biome-deadwood",
        "proto-biome-ground-cover"
      ],
      "functions": ["wetland-flight-scenery", "conditional-off-airport-terrain-landing"],
      "waterAccess": "visual-only",
      "roadAccess": "none"
    },
    {
      "id": "region-biome-red-rock-canyon",
      "runtimeBiomeId": "red-rock-canyon",
      "kind": "procedural-biome-template",
      "label": "Red Rock Canyon",
      "semanticColor": "#B94D35",
      "terrainProfile": "terraced-canyon-relief",
      "palette": {
        "ground": "#a64f32",
        "roughness": 1,
        "primary": "#70402d",
        "secondary": "#d17b43",
        "accent": "#e6aa58",
        "rock": "#7d382a",
        "water": "#447a86"
      },
      "prototypeTargetsPerChunk": {
        "broadMesas": 42,
        "narrowPillars": 34,
        "rocks": 58,
        "cacti": 20
      },
      "repeatedAssetIds": [
        "proto-biome-mesa",
        "proto-biome-rock",
        "proto-biome-cactus"
      ],
      "functions": ["canyon-flight-scenery", "conditional-off-airport-terrain-landing"],
      "waterAccess": "none",
      "roadAccess": "none"
    },
    {
      "id": "region-biome-autumn-forest",
      "runtimeBiomeId": "autumn-forest",
      "kind": "procedural-biome-template",
      "label": "Autumn Forest",
      "semanticColor": "#C2672E",
      "terrainProfile": "rolling-forest",
      "palette": {
        "ground": "#6f5535",
        "roughness": 0.98,
        "primary": "#8d3324",
        "secondary": "#d37b2d",
        "accent": "#efb943",
        "rock": "#665c50",
        "water": "#476f76"
      },
      "prototypeTargetsPerChunk": {
        "trees": 88,
        "groundCover": 185,
        "rocks": 42,
        "deadwood": 22
      },
      "repeatedAssetIds": [
        "proto-biome-trunk",
        "proto-biome-canopy",
        "proto-biome-ground-cover",
        "proto-biome-rock",
        "proto-biome-deadwood"
      ],
      "functions": ["seasonal-forest-flight-scenery", "conditional-off-airport-terrain-landing"],
      "waterAccess": "none",
      "roadAccess": "none"
    },
    {
      "id": "region-biome-tropical-lagoon",
      "runtimeBiomeId": "tropical-lagoon",
      "kind": "procedural-biome-template",
      "label": "Tropical Lagoon",
      "semanticColor": "#13A58D",
      "terrainProfile": "low-islands",
      "palette": {
        "ground": "#2f794d",
        "roughness": 0.91,
        "primary": "#1f6f4b",
        "secondary": "#62a949",
        "accent": "#f0d85f",
        "rock": "#6e7767",
        "water": "#28a7a4"
      },
      "prototypeTargetsPerChunk": {
        "visualWaterPatches": 38,
        "palms": 58,
        "trees": 44,
        "groundCover": 155,
        "rocks": 38
      },
      "repeatedAssetIds": [
        "proto-biome-water",
        "proto-biome-trunk",
        "proto-biome-frond",
        "proto-biome-canopy",